cid,cmpdname,cmpdsynonym,mw,mf,polararea,complexity,xlogp,heavycnt,hbonddonor,hbondacc,rotbonds,inchi,isosmiles,canonicalsmiles,inchikey,iupacname,exactmass,monoisotopicmass,charge,covalentunitcnt,isotopeatomcnt,totalatomstereocnt,definedatomstereocnt,undefinedatomstereocnt,totalbondstereocnt,definedbondstereocnt,undefinedbondstereocnt,pclidcnt,gpidcnt,gpfamilycnt,neighbortype,meshheadings,annothits,annothitcnt,aids,cidcdate,sidsrcname,depcatg,annotation
65077,Dansylamide,"Dansylamide|1431-39-6|5-(dimethylamino)naphthalene-1-sulfonamide|5-Dimethylaminonaphthalene-1-sulfonamide|5-(DIMETHYLAMINO)-1-NAPHTHALENESULFONAMIDE|5-DIMETHYLAMINO-1-NAPHTHALENESULFONAMIDE|1-Naphthalenesulfonamide, 5-(dimethylamino)-|ZUZ5S5875E|Dansyl amide|1okl|EINECS 215-854-1|Dansyl-1-sulfonamide|5-(Dimethylamino)naphthalene-1-sulphonamide|UNII-ZUZ5S5875E|Oprea1_628153|SCHEMBL108421|CHEMBL119489|BDBM11402|TYNBFJJKZPTRKS-UHFFFAOYSA-|DTXSID70162306|BAA43139|5-Dimethylamino-1-naphthylsulfonamid|DANSYLAMIDE [FOR FLUOROMETRY]|MFCD00004000|STK367047|AKOS003242506|DB02866|1-Dimethylaminonaphthalene-5-sulfonamide|5-(dimethylamino)-1-naphthylsulfonamide|Dansylamide [for Albumin binding assay]|5-dimethylamino-1-naphthalenesulphonamide|5-Dimethylamino-1-naphthalene sulfonamide|AS-56325|BP-12687|HY-118562|CS-0067480|D1507|D5405|FT-0624411|EN300-372001|T70280|1-(DIMETHYLAMINO)-5-NAPHTHALENESULFONAMIDE|5-(Dimethylamino)-1-naphthalenesulfonamide, 99%|A808021|Q4154890|Z275140824|5-(Dimethylamino)-1-naphthalenesulfonamide, for fluorescence, >=98.5% (TLC)|InChI=1/C12H14N2O2S/c1-14(2)11-7-3-6-10-9(11)5-4-8-12(10)17(13,15)16/h3-8H,1-2H3,(H2,13,15,16)",250.320,C12H14N2O2S,71.800,361.000,2.000,17,1,4,2,"InChI=1S/C12H14N2O2S/c1-14(2)11-7-3-6-10-9(11)5-4-8-12(10)17(13,15)16/h3-8H,1-2H3,(H2,13,15,16)",CN(C)C1=CC=CC2=C1C=CC=C2S(=O)(=O)N,CN(C)C1=CC=CC2=C1C=CC=C2S(=O)(=O)N,TYNBFJJKZPTRKS-UHFFFAOYSA-N,5-(dimethylamino)naphthalene-1-sulfonamide,250.078,250.078,0,1,0,0,0,0,0,0,0,317,1965,642,2D+3D,NULL,Biological Test Results|Classification|Literature|Patents|Pharmacology and Biochemistry,7,1811|27788|47910|977611|1159387|1159388|1671202,20050327,"001Chemical|3B Scientific (Wuhan) Corp|3WAY PHARM INC|A&J Pharmtech CO., LTD.|A2B Chem|AA BLOCKS|Aaron Chemicals LLC|AbaChemScene|abcr GmbH|ABI Chem|Achemo Scientific Limited|Acorn PharmaTech Product List|AHH Chemical co.,ltd|AK Scientific, Inc. (AKSCI)|AKos Consulting & Solutions|Alfa Chemistry|Alichem|Amadis Chemical|Ambeed|Angel Pharmatech Ltd.|AstaTech, Inc.|BenchChem|BindingDB|Biosynth|BLD Pharm|BOC Sciences|BroadPharm|Chem-Space.com Database|ChemBank|Chembase.cn|ChEMBL|ChemDB|ChemDiv|Chemenu Inc.|ChemExper Chemical Directory|ChemFish Tokyo Co., Ltd.|ChemIDplus|Chemieliva Pharmaceutical Co., Ltd|ChemMol|ChemSpider|Combi-Blocks|Cooke Chemical Co., Ltd|CSNpharm|CymitQuimica|Debye Scientific Co., Ltd|DiscoveryGate|DrugBank|Egon Willighagen (Dept. of Bioinformatics - BiGCaT, Maastricht University)|Enamine|eNovation Chemicals|EPA DSSTox|FDA Global Substance Registration System (GSRS)|Finetech Industry Limited|Google Patents|Human Metabolome Database (HMDB)|Hunan Chemfish Pharmaceutical Co., Ltd.|IBM|iChemical Technology USA Inc|ISpharm|Japan Chemical Substance Dictionary (Nikkaji)|Key Organics/BIONET|LabNetwork, a WuXi AppTec Company|LEAPCHEM|Mcule|MedChemexpress MCE|MolCore BioPharmatech|MolPort|MP Biomedicals|MuseChem|NCBI Structure|NextBio|NextMove Software|NIST Mass Spectrometry Data Center|NMRShiftDB|NORMAN Suspect List Exchange|NovoSeek|Oakwood Products|Parchem|PATENTSCOPE (WIPO)|Pi Chemicals|Probes & Drugs portal|Protein Data Bank in Europe (PDBe)|RR Scientific|Santa Cruz Biotechnology, Inc.|SCRIPDB|Shanghai Institute of Organic Chemistry|Sigma-Aldrich|SMID|Smolecule|Springer Nature|Starshine Chemical|SureChEMBL|TargetMol|TCI (Tokyo Chemical Industry)|THE BioTek|Therapeutic Target Database (TTD)|Thermo Fisher Scientific|Thomson Pharma|TimTec|ToxPlanet|University of Iowa High-Throughput Screening Core (UIHTS)|University of Kansas High Throughput Screening Laboratory|Vitas-M Laboratory|VladaChem|Wikidata|Yick-Vic Chemicals & Pharmaceuticals (HK) Ltd.|Yuhao Chemical|ZINC",Chemical Vendors|Curation Efforts|Governmental Organizations|Journal Publishers|Legacy Depositors|Research and Development|Subscription Services,D004396 - Coloring Agents > D005456 - Fluorescent Dyes|D019995 - Laboratory Chemicals > D007202 - Indicators and Reagents > D003619 - Dansyl Compounds|D019995 - Laboratory Chemicals > D007202 - Indicators and Reagents > D049408 - Luminescent Agents
122235,1-(N(sup alpha)-Dansyl-L-arginyl)-4-ethylpiperidine,"1-(N(sup alpha)-Dansyl-L-arginyl)-4-ethylpiperidine|55381-72-1|2-[(4S)-4-[[5-(dimethylamino)naphthalen-1-yl]sulfonylamino]-5-(4-ethylpiperidin-1-yl)-5-oxopentyl]guanidine|1fpc|BRN 1612577|dansylarginine N-(3-ethyl-1,5-pentanediyl)amide|Amino{[(4s)-4-({[5-(Dimethylamino)naphthalen-1-Yl]sulfonyl}amino)-5-(4-Ethylpiperidin-1-Yl)-5-Oxopentyl]amino}methaniminium|DTXSID70970721|Piperidine, 1-(5-((aminoiminomethyl)amino)-2-(((5-(dimethylamino)-1-naphthalenyl)sulfonyl)amino)-1-oxopentyl)-4-ethyl-, (S)-|0ZI|N-[5-Carbamimidamido-1-(4-ethylpiperidin-1-yl)-1-oxopentan-2-yl]-5-(dimethylamino)naphthalene-1-sulfonamide",502.700,C25H38N6O3S,143.000,816.000,2.800,35,3,6,10,"InChI=1S/C25H38N6O3S/c1-4-18-13-16-31(17-14-18)24(32)21(10-7-15-28-25(26)27)29-35(33,34)23-12-6-8-19-20(23)9-5-11-22(19)30(2)3/h5-6,8-9,11-12,18,21,29H,4,7,10,13-17H2,1-3H3,(H4,26,27,28)/t21-/m0/s1",CCC1CCN(CC1)C(=O)[C@H](CCCN=C(N)N)NS(=O)(=O)C2=CC=CC3=C2C=CC=C3N(C)C,CCC1CCN(CC1)C(=O)C(CCCN=C(N)N)NS(=O)(=O)C2=CC=CC3=C2C=CC=C3N(C)C,IIYZWOIELWZHJV-NRFANRHFSA-N,2-[(4S)-4-[[5-(dimethylamino)naphthalen-1-yl]sulfonylamino]-5-(4-ethylpiperidin-1-yl)-5-oxopentyl]guanidine,502.273,502.273,0,1,0,1,1,0,0,0,0,32,81,32,2D+3D,NULL,Biological Test Results|Classification|Literature|Patents|Pharmacology and Biochemistry|Toxicity,7,1811|977610,20050624,"AAA Chemistry|ABI Chem|BenchChem|ChemIDplus|ChemSpider|EPA DSSTox|Google Patents|IBM|J&H Chemical Co.,ltd|LeadScope|NCBI Structure|NextBio|NovoSeek|Protein Data Bank in Europe (PDBe)|RR Scientific|Shanghai Institute of Organic Chemistry|SMID|THE BioTek|ToxPlanet",Chemical Vendors|Curation Efforts|Governmental Organizations|Legacy Depositors|Research and Development|Subscription Services,D004396 - Coloring Agents > D005456 - Fluorescent Dyes|D019995 - Laboratory Chemicals > D007202 - Indicators and Reagents > D003619 - Dansyl Compounds|D019995 - Laboratory Chemicals > D007202 - Indicators and Reagents > D049408 - Luminescent Agents
5460680,p-Mercuribenzoate,p-Mercuribenzoate|4-mercuribenzoate|(4-carboxylatophenyl)mercury|3m1j|CHEBI:20435|(4-carboxylatophenyl)mercurate(1-)|Q27109299,320.700,C7H4HgO2-,40.100,122.000,NULL,10,0,2,0,"InChI=1S/C7H5O2.Hg/c8-7(9)6-4-2-1-3-5-6;/h2-5H,(H,8,9);/p-1",C1=CC(=CC=C1C(=O)[O-])[Hg],C1=CC(=CC=C1C(=O)[O-])[Hg],FVFZSVRSDNUCGG-UHFFFAOYSA-M,(4-carboxylatophenyl)mercury,321.992,321.992,-1,1,0,0,0,0,0,0,0,17,408,86,2D,NULL,Biological Test Results|Classification|Literature|Patents,5,977608,20040916,"ABI Chem|BenchChem|BioCyc|ChEBI|ChemSpider|Comparative Toxicogenomics Database (CTD)|Egon Willighagen (Dept. of Bioinformatics - BiGCaT, Maastricht University)|Google Patents|NextBio|Shanghai Institute of Organic Chemistry|Wikidata",Chemical Vendors|Curation Efforts|Legacy Depositors|Research and Development|Subscription Services,"D004791 - Enzyme Inhibitors > D008626 - Mercuribenzoates|D010575 - Pesticides > D005659 - Fungicides, Industrial > D010663 - Phenylmercury Compounds"
446468,"N,O-Didansyl-L-tyrosine","N,O-DIDANSYL-L-TYROSINE|CHEMBL176072|1jg0|N,O-diansyl-L-tyrosine|Dansyl derivative, DDT, 1L|Dansyltyrosine deriviative 21B|SCHEMBL4325460|BDBM50161779|DB03157|N,O-bis{[5-(dimethylamino)naphthalen-1-yl]sulfonyl}-L-tyrosine|(S)-2-(5-Dimethylamino-naphthalene-1-sulfonylamino)-3-[4-(5-dimethylamino-naphthalene-1-sulfonyloxy)-phenyl]-propionic acid",647.800,C33H33N3O7S2,150.000,1210.000,6.300,45,2,10,11,"InChI=1S/C33H33N3O7S2/c1-35(2)29-13-5-11-26-24(29)9-7-15-31(26)44(39,40)34-28(33(37)38)21-22-17-19-23(20-18-22)43-45(41,42)32-16-8-10-25-27(32)12-6-14-30(25)36(3)4/h5-20,28,34H,21H2,1-4H3,(H,37,38)/t28-/m0/s1",CN(C)C1=CC=CC2=C1C=CC=C2S(=O)(=O)N[C@@H](CC3=CC=C(C=C3)OS(=O)(=O)C4=CC=CC5=C4C=CC=C5N(C)C)C(=O)O,CN(C)C1=CC=CC2=C1C=CC=C2S(=O)(=O)NC(CC3=CC=C(C=C3)OS(=O)(=O)C4=CC=CC5=C4C=CC=C5N(C)C)C(=O)O,LUBOPDUYHWABFG-NDEPHWFRSA-N,(2S)-2-[[5-(dimethylamino)naphthalen-1-yl]sulfonylamino]-3-[4-[5-(dimethylamino)naphthalen-1-yl]sulfonyloxyphenyl]propanoic acid,647.176,647.176,0,1,0,1,1,0,0,0,0,7,29,12,2D+3D,NULL,Biological Test Results|Classification|Literature|Patents,5,1811|238383|238708|238754|239796|239797|977608|1799451|1799474|1799622,20050624,"AbaChemScene|ABI Chem|Alfa Chemistry|Aurora Fine Chemicals LLC|BenchChem|BindingDB|Chembase.cn|ChEMBL|Chemieliva Pharmaceutical Co., Ltd|ChemSpider|DiscoveryGate|DrugBank|EPA DSSTox|IBM|MedChemexpress MCE|MuseChem|NCBI Structure|NextBio|NORMAN Suspect List Exchange|PATENTSCOPE (WIPO)|Probes & Drugs portal|Protein Data Bank in Europe (PDBe)|Shanghai Institute of Organic Chemistry|Sigma-Aldrich|SMID|Smolecule|Springer Nature|SureChEMBL|THE BioTek|Therapeutic Target Database (TTD)|Thomson Pharma|Wikidata|ZINC",Chemical Vendors|Curation Efforts|Governmental Organizations|Journal Publishers|Legacy Depositors|Research and Development|Subscription Services,D019995 - Laboratory Chemicals > D007202 - Indicators and Reagents > D003619 - Dansyl Compounds
5362487,Sulfur,"231-722-6|7704-34-9|9035-99-8|Agri-Sul|AN-Sulfur Colloid Kit|Aquilite|Asulfa-Supra|Atomic sulfur|Bensulfoid|Brimstone|Colloidal sulfur|Colloidal-S|Devisulphur|elemental sulfur|Flour sulfur|Flour sulphur|Flowers of sulfur|Flowers of sulphur|Gofrativ|Ground vocle sulfur|Ground vocle sulphur|Precipitated sulfur|S|Sofril|Solfa|Soufre|Soufre [ISO-French]|Sperlox-S|Spersul|Spersul thiovit|Sublimed sulfur|Sublimed sulphur|Suffa|Sufran|Sufran D|Sulfex|Sulfidal|Sulforon|Sulfospor|Sulfur|sulfur (0)|Sulfur (JP17)|Sulfur (molten)|Sulfur [NA1350] [Class 9]|Sulfur [UN1350] [Flammable solid]|Sulfur 10 microg/mL in Isooctane|Sulfur atom|Sulfur bactericide,fumigant|Sulfur Compounds|Sulfur hydride|Sulfur hydroxide|Sulfur in Isooctane standard solution, Specpure, 100g/g (0.010%)|Sulfur in Isooctane standard solution, Specpure, 10g/g (0.001%)|Sulfur in Isooctane standard solution, Specpure?, 25?g/g (0.0025%)|Sulfur ointment|Sulfur precipitated|Sulfur Soap|Sulfur vapor|Sulfur, 99.998% trace metals basis|SULFUR, 99.999%|Sulfur, colloidal, metastable technetium-99 labeled|Sulfur, elemental|Sulfur, flakes, >=99.99% trace metals basis|Sulfur, LR, >=99%|Sulfur, molten [NA2448] [Class 9]|Sulfur, molten [UN2448] [Flammable solid]|Sulfur, monoclinic|Sulfur, PESTANAL(R), analytical standard|Sulfur, pharmaceutical|Sulfur, powder, 99.98% trace metals basis|Sulfur, powder, colloidal|Sulfur, precipitated|Sulfur, precipitated (USP)|Sulfur, precipitated [USP]|Sulfur, prilled, >=99.99 trace metals basis|Sulfur, puriss., 95.0%|Sulfur, puriss., 99.5-100.5%, meets analytical specification of Ph. Eur., BP, USP, precipitated|Sulfur, purum p.a., >=99.5% (T)|Sulfur, reagent grade, powder, purified by refining, -100 mesh particle size|Sulfur, reagent grade, purified by sublimation, -100 mesh particle size, powder|Sulfur, rhombic|Sulfur, SAJ first grade, >=98.0%|Sulfur, solid|Sulfur, sublimed|Sulfur, sublimed (USP)|Sulfur, sublimed [USP]|Sulikol|Sulkol|sulphur|Sulphur [ISO]|Sulphur, precipitated, sublimed or colloidal|Sulsol|Sultaf|Super cosan|Super Six|Svovl|TechneColl|TechneScan Sulfur Colloid|Tesuloid|Thiolux|Thion|Thiovit|Thiovit S|Thiozol|Ultra Sulfur|Wettasul|Zolvis|Sulfur (>80per cent)|Armarita|Prosacea|Sulfaderm|DermaWash|Motto|NaturasilScabies|Lemaitre Sulfur|Spot Correction|Sulfur Lotion|Amino Mask|Dermaline Sulfur|Madina Acne|NaturasilRingworm|Sulfo lo|sulfur suspension|Malin and Goetz|Dr Berrys|Acne LotionSulfur|PowerSpot Cleanse|Clinicians Complex|DermaWash S2|NaturasilJock Itch|Sulfur 6|Acne Drying Lotion|Acne Sulfur Lotion|Sulfur 3X|Sulfur Facial Wash|Sulphur Kit Refill|Aqua KAVI|CliXit Acne Eraser|Sulphur 12X|Sulphur 30C|Amino MaskBioelements|LIQUIMAT|SULFER|SULPHOR|Sulphur 200C|Sulphur7138|THYLOX|NaturasilAthletes Foot|Sulfur Spot Treatment|EradiKate Facial Mask|DEEP ACNE|Sulfur 3% Soap Bar|ariSulfurAcne Treatment|Acne LotionSulfurSulfur|END-ZIT|SULPHUR200ck|Therapeutic Sulfur Mask|DHC Acne Spot Therapy|caring mill Acne Drying|Sulfur 3 Special Order|SULPHUR 6C|Overnight Spot Treatment|Renu Laboratories Drying|Super-Sulfur Magic Mask|TreeActiv Spot Treatment|Calm Eczema Therapy Wash|Concealing Spot Treatment|Organic Sulfur Suspension|CLIXIT ACNE DRYING|Dermaharmony 10% Sulfur|Sulfur 30 Special Order|Acne Clearing Sulfur Mask|Calm Eczema Therapy Cream|Kate Summerville EradiKate|NaturasilInternal Parasites|MINERAL BLEMISH KIT|NERD ACNE TREATMENT|SULFUR CALMING MASK|Epionce Purifying Spot Gel|SULFUR 3%|UNBLEMISH Clarifying Mask|bareMinerals Blemish Therapy|ELFMineral Blemish Kit Box|EradiKate ACNE TREATMENT|Glytone Acne Treatment Mask|SULFUR ACNE TREATMENT|Acne Control Clarifying Mask|Lemaitre SulfurAcne treatment|Sulfur Acne Foaming Cleanser|Derma E Acne Clarifying Mask|Malin and GoetzAcne Treatment|Kalium Sulfuratum Bath Essence|Rapid Relief Acne Sulfur Mask|Activ O2 Acne Treatment Cream|caring mill Acne Spot Treatment|QUICK DRY ACNE TREATMENT|Sulfur Facial WashAcne Cleanser|DTXCID7014941|DTXSID9034941|Earths Care Acne Spot Treatment|Earths Care Acne Treatment Mask|Game Over Acne Drying Treatment|EradiKate Daily Foaming Cleanser|CLIXIT ACNE SPOT TREATMENT|FEIXBIOAZUFRE / BIOSULPHUR|Matys Organic Baby Eczema Relief|Belli Acne Control Spot Treatment|Get Clarity Foaming Acne Cleanser|MDacne Customized Cream (Sulfur)|De La Cruz Sulfur Acne Medication|Naturium Sulfur Spot Treatment 8%|Dr BerrysMulti-purpose sulfur Creme|ACNE AND BLEMISH CONTROL MASK|Neutrogena Stubborn Acne Spot Drying|Proactiv Clean Mineral Acne Cleanser|TreeActiv Cystic Acne Spot Treatment|Treatment 101Acne Clearing Treatment|CLIXIT TINTED BLEMISH CONCEALER|Glovers Dandruff Control Med., Floral|Glytone Acne Clarifying Treatment Mask|2-(Perfluoroalkyl)ethyl allyl sulphide|CelestyAcne Series Instant Repair Mask|Shaant Spot Hero Drying Acne Treatment|CLIXIT TINTED BLEMISH CONCEALERLight|The INKEY List Acne Clearing Moisturizer|CLIXIT TINTED BLEMISH CONCEALERMedium|Glovers Dandruff Control Medicine, Regular|LIQUIMATACNE TREATMENT AND COVER-UP|Philosophy Clear Days Ahead Acne Treatment|EradiKate Daily Foaming CleanserAcne Treatment|Anna Guanche MD Miracle Cream The Pimple Cream|SUNDAY RILEY SULFUR ACNE TREATMENT MASK|Rodan and FieldsUnblemish 1 Wash Acne Medicated Cleanser|Soft Services CLEARING Clay Multi-Use Breakout Treatment|SUNDAY RILEY SATURN SULFUR ACNE SPOT TREATMENT MASK|Vichy Laboratoires Normaderm SOS Acne Rescue Spot Corrector|Josie Maran-Argan Apothecary Daily Response Calming Treatment|Kiehls Since 1851 Dermatologist Solutions Breakout Control Targeted Acne Spot Treatment",32.070,S,1.000,0.000,0.500,1,0,1,0,InChI=1S/S,[S],[S],NINIDFKCEFEMDL-UHFFFAOYSA-N,sulfur,31.9721,31.9721,0,1,0,0,0,0,0,0,0,18229,59,38,2D,Sulfur|Sulfur Compounds,Agrochemical Information|Chemical and Physical Properties|Classification|Drug and Medication Information|Food Additives and Ingredients|Literature|Patents|Pharmacology and Biochemistry|Safety and Hazards|Toxicity|Use and Manufacturing,14,NULL,20050808,"1st Scientific|A2B Chem|AA BLOCKS|Aaron Chemicals LLC|Achemica|Anward|BenchChem|BLD Pharm|BOC Sciences|ChEBI|Chembase.cn|ChemTik|Collaborative Drug Discovery, Inc.|Comparative Toxicogenomics Database (CTD)|CymitQuimica|Fisher Chemical|Hairui Chemical|iChemical Technology USA Inc|J&H Chemical Co.,ltd|King Scientific|MuseChem|NextBio|NIST Chemistry WebBook|PATENTSCOPE (WIPO)|PubChem Reference Collection|Santa Cruz Biotechnology, Inc.|SCRIPDB|Smolecule|Starshine Chemical|THE BioTek|VladaChem|VWR, Part of Avantor|Win-Win Chemical|Yick-Vic Chemicals & Pharmaceuticals (HK) Ltd.",Chemical Vendors|Curation Efforts|Governmental Organizations|Legacy Depositors|Research and Development|Subscription Services,D - Dermatologicals > D10 - Anti-acne preparations > D10A - Anti-acne preparations for topical use > D10AB - Preparations containing sulfur|D - Dermatologicals > D11 - Other dermatological preparations > D11A - Other dermatological preparations > D11AC - Medicated shampoos
5359596,Arsenic,"7440-38-2|Arsenic|As|Agent SA|Arsenowodor|Arsen|Arsenic hydride (AsH3)|ARSENIC METAL|V1I29R0RJQ|Arsenicals|CHEBI:27563|Arsenic-75|Gray arsenic|Colloidal arsenic|Arsenic, inorganic|Arsenicals; Arsenic, inorganic; Arsen|CCRIS 55|Arsenic 75|HSDB 509|HSDB 510|EINECS 231-148-6|EINECS 232-066-3|UN2188|Arsenic Standard: As @ 1000 microg/mL in 5% HNO3|UNII-V1I29R0RJQ|Arsenic Standard: As @ 10000 microg/mL in 5% HNO3|arsenico|arsenicum|Arsenic AA Standard: As @ 1000 microg/mL in 5% HNO3|Arsinidene|Arsenic Standard: 1000 microg/g As in 75 cSt Hydrocarbon Oil|arsenic atom|Arsenic sponge|UNII-N712M78A8G|Arsenic, lump|Inorganic arsenic|ARSINO|04 - Elements|19 - Lipstick|21 - Powder sample|2B - Trace elements|ARSENIC, SOLID|ARSENIC, METALLIC|20 - Lip gloss sample|ARSINE [MI]|ARSENIC, (SOLID)|ARSENICUM METALLICUM|33As|EC 232-066-3|S36 - Organic Fertilizer|ARSENIC METAL: ARSENIA|62 - Saline Water - Metals|DTXCID703886|13 - Sewage Sludge Inorganics|CHEMBL1231052|DTXSID3023760|DTXSID4023886|Various Lead Alloy, 50g Chips|CHEBI:35826|104 - Saline Water - Metals|RQNWIZPPADIBDY-UHFFFAOYSA-N|DTXSID201080837|DTXSID501080836|N712M78A8G|02 - Sample 2 Cane/Beet Sugar|Arsenic, >=99.999%, pieces|14 - Agricultural Soil Inorganics|Arsine [UN2188]  [Poison gas]|AKOS015902733|Arsenic, 99.999% trace metals basis|2 - Minerals and elements in animal feed|FT-0696579|C06269|Arsenic - As @ 1000 microg/mL in 5% HNO3|14 - Elemental contamination in herbal supplement|17 - Elemental contamination in Pollen supplement|Arsenic, powder, >=99.997% trace metals basis|8 - Minerals and trace elements in premix materials|Arsenic Standard: As @ 10 microg/mL in 2% HNO3|ARSENIC AND INORGANIC ARSENIC COMPOUNDS (IARC)|Q21060492|Arsenic Standard: As @ 1000 microg/g in Hydrocarbon Oil|Arsenic Hollow Cathode Lamp: 1.5' Diameter, 2-pin, Non-Coded|Arsenic Hollow Cathode Lamp: 2.0' Diameter, 4-pin, Cableless|Arsenic Hollow Cathode Lamp: 2.0' Diameter, 9-pin, Non-Coded|AQ-14-QC sample 14 - Agricultural Soil Inorganics and Specific Elements|Arsenic polycrystalline lump, 2-8mm (0.08-0.3in), 99.9999% (metals basis)|Arsenic polycrystalline lump, 2-8mm (0.08-0.3in), 99.99999% (metals basis)",74.921,As,0.000,0.000,NULL,1,0,0,0,InChI=1S/As,[As],[As],RQNWIZPPADIBDY-UHFFFAOYSA-N,arsenic,74.9216,74.9216,0,1,0,0,0,0,0,0,0,651,43,34,2D,NULL,Biological Test Results|Chemical and Physical Properties|Classification|Drug and Medication Information|Food Additives and Ingredients|Identification|Literature|Patents|Pharmacology and Biochemistry|Safety and Hazards|Toxicity|Use and Manufacturing,16,678929|678930|678931|682032|1079931|1079932|1079933|1079934|1079935|1079936|1079937|1079938|1079939|1079940|1079941|1079942|1079943|1079944|1079945|1079946|1079947|1079948|1079949|1259407|1259408|1259411,20050624,"1st Scientific|A2B Chem|AA BLOCKS|Aaron Chemicals LLC|abcr GmbH|ABI Chem|AK Scientific, Inc. (AKSCI)|AKos Consulting & Solutions|Ambinter|Aromalake Chemical|Aurora Fine Chemicals LLC|BenchChem|BOC Sciences|ChEBI|Chembase.cn|ChEMBL|ChemDB|Chemical Carcinogenesis Research Information System (CCRIS)|ChemIDplus|Chemieliva Pharmaceutical Co., Ltd|ChemMol|ChemSpider|ChemTik|Collaborative Drug Discovery, Inc.|Comparative Toxicogenomics Database (CTD)|Cooke Chemical Co., Ltd|CymitQuimica|DiscoveryGate|DTP/NCI|Egon Willighagen (Dept. of Bioinformatics - BiGCaT, Maastricht University)|eNovation Chemicals|EPA DSSTox|EPA Substance Registry Services|FDA Global Substance Registration System (GSRS)|Finetech Industry Limited|Genetic Toxicology Data Bank (GENE-TOX)|Google Patents|iChemical Technology USA Inc|ISpharm|J&H Chemical Co.,ltd|Japan Chemical Substance Dictionary (Nikkaji)|KEGG|LabNetwork, a WuXi AppTec Company|LeadScope|LEAPCHEM|LGC Standards|MP Biomedicals|MuseChem|Nature Chemistry|NextBio|NextMove Software|NIST Chemistry WebBook|NORMAN Suspect List Exchange|NovoSeek|Parchem|PATENTSCOPE (WIPO)|PubChem Reference Collection|RR Scientific|Santa Cruz Biotechnology, Inc.|SCRIPDB|Sigma-Aldrich|SMID|Smolecule|Springer Nature|SpringerMaterials|Strem Chemicals, Inc.|SureChEMBL|THE BioTek|Thermo Fisher Scientific|Thieme Chemistry|Thomson Pharma|ToxPlanet|Tractus|VladaChem|VWR, Part of Avantor|Wikidata|Wiley|Wubei-Biochem|Yick-Vic Chemicals & Pharmaceuticals (HK) Ltd.",Chemical Vendors|Curation Efforts|Governmental Organizations|Journal Publishers|Legacy Depositors|Research and Development|Subscription Services,NULL
